{
  "check_errors": [],
  "components": [
    {
      "component": "busybox",
      "cves": [
        "CVE-2022-48174"
      ],
      "filesystem": "image/squashfs@0x10000",
      "paths": [
        "/bin/busybox"
      ],
      "version": "1.36.1"
    },
    {
      "component": "dnsmasq",
      "cves": [
        "CVE-2020-25681"
      ],
      "filesystem": "image/squashfs@0x10000",
      "paths": [
        "/usr/sbin/dnsmasq"
      ],
      "version": "2.80"
    }
  ],
  "entropy": {
    "block_size": 4096,
    "mean": 2.96,
    "regions": [
      {
        "end": 12288,
        "kind": "high",
        "mean_entropy": 7.924,
        "start": 0
      },
      {
        "end": 16384,
        "kind": "mixed",
        "mean_entropy": 6.344,
        "start": 12288
      },
      {
        "end": 65536,
        "kind": "low",
        "mean_entropy": 0.0,
        "start": 16384
      },
      {
        "end": 81920,
        "kind": "high",
        "mean_entropy": 7.802,
        "start": 65536
      },
      {
        "end": 196608,
        "kind": "low",
        "mean_entropy": 0.03,
        "start": 81920
      },
      {
        "end": 262144,
        "kind": "high",
        "mean_entropy": 7.953,
        "start": 196608
      }
    ],
    "sparkline": "\u2588\u2588\u2588\u2586            \u2588\u2588\u2588\u2588            \u2581               \u2588\u2588\u2588\u2588\u2588\u2588\u2588\u2588\u2588\u2588\u2588\u2588\u2588\u2588\u2588\u2588"
  },
  "extraction": [
    {
      "children": [
        "image/uimage@0x0",
        "image/squashfs@0x10000"
      ],
      "depth": 0,
      "id": "image",
      "kind": "image",
      "length": 262144,
      "meta": {
        "claimed_bytes": 31069
      },
      "notes": [],
      "offset": 0,
      "parent": null
    },
    {
      "children": [
        "image/uimage@0x0/gzip@0x0"
      ],
      "depth": 1,
      "id": "image/uimage@0x0",
      "kind": "uimage",
      "length": 15123,
      "meta": {
        "arch": "mips",
        "claimed_bytes": 15059,
        "compression": "gzip",
        "data_crc_ok": true,
        "data_size": 15059,
        "entry_point": "0x80000000",
        "header_crc_ok": true,
        "load_addr": "0x80000000",
        "name": "synth kernel",
        "os": "linux",
        "type": "kernel"
      },
      "notes": [],
      "offset": 0,
      "parent": "image"
    },
    {
      "children": [],
      "depth": 2,
      "id": "image/uimage@0x0/gzip@0x0",
      "kind": "gzip",
      "length": 15059,
      "meta": {
        "claimed_bytes": 0,
        "complete": true,
        "decompressed_size": 71458
      },
      "notes": [],
      "offset": 0,
      "parent": "image/uimage@0x0"
    },
    {
      "children": [],
      "depth": 1,
      "id": "image/squashfs@0x10000",
      "kind": "squashfs",
      "length": 15946,
      "meta": {
        "block_size": 131072,
        "compression": "xz",
        "entries": 54,
        "file_bytes": 14951,
        "files": 18
      },
      "notes": [],
      "offset": 65536,
      "parent": "image"
    }
  ],
  "filesystems": [
    {
      "entries": 54,
      "file_bytes": 14951,
      "files": 18,
      "format": "squashfs",
      "id": "image/squashfs@0x10000",
      "offset": 65536,
      "rejected_members": 0
    }
  ],
  "findings": [
    {
      "category": "component",
      "detail": "busybox 1.36.1 is affected by 1 CVE(s) in the offline subset: CVE-2022-48174",
      "evidence": {
        "component": "busybox",
        "cves": [
          {
            "affected": ">= 0, <= 1.36.1",
            "cvss": 9.8,
            "id": "CVE-2022-48174",
            "summary": "ash stack overflow in arithmetic evaluation, may lead to code execution"
          }
        ],
        "paths": [
          "/bin/busybox"
        ],
        "version": "1.36.1"
      },
      "filesystem": "image/squashfs@0x10000",
      "id": "F-c29e9e0ec764",
      "offset": null,
      "path": "/bin/busybox",
      "remediation": "Upgrade the component to a fixed release.",
      "rule_id": "FWA-CMP-002",
      "severity": "critical",
      "title": "Component version affected by known CVEs (offline subset)"
    },
    {
      "category": "credentials",
      "detail": "account 'root' can log in without a password",
      "evidence": {
        "line": 1,
        "user": "root"
      },
      "filesystem": "image/squashfs@0x10000",
      "id": "F-cd13bec553ec",
      "offset": null,
      "path": "/etc/passwd",
      "remediation": "Set a password or lock the account ('!' in /etc/shadow).",
      "rule_id": "FWA-CRED-001",
      "severity": "critical",
      "title": "Login account with an empty password"
    },
    {
      "category": "credentials",
      "detail": "password for 'support' is the default/guessable value su*** (len 7)",
      "evidence": {
        "line": 5,
        "password": "su*** (len 7)",
        "scheme": "md5",
        "user": "support"
      },
      "filesystem": "image/squashfs@0x10000",
      "id": "F-ea6d2b997918",
      "offset": null,
      "path": "/etc/passwd",
      "remediation": "Remove factory-default passwords; force a unique password at first boot.",
      "rule_id": "FWA-CRED-004",
      "severity": "critical",
      "title": "Hardcoded default password (hash cracked with the offline default list)"
    },
    {
      "category": "component",
      "detail": "dnsmasq 2.80 is affected by 1 CVE(s) in the offline subset: CVE-2020-25681",
      "evidence": {
        "component": "dnsmasq",
        "cves": [
          {
            "affected": ">= 0, < 2.83",
            "cvss": 8.1,
            "id": "CVE-2020-25681",
            "summary": "DNSpooq: heap overflow sorting RRSets for DNSSEC validation"
          }
        ],
        "paths": [
          "/usr/sbin/dnsmasq"
        ],
        "version": "2.80"
      },
      "filesystem": "image/squashfs@0x10000",
      "id": "F-139eb8a64d3c",
      "offset": null,
      "path": "/usr/sbin/dnsmasq",
      "remediation": "Upgrade the component to a fixed release.",
      "rule_id": "FWA-CMP-002",
      "severity": "high",
      "title": "Component version affected by known CVEs (offline subset)"
    },
    {
      "category": "credentials",
      "detail": "password hash for 'support' is stored in /etc/passwd",
      "evidence": {
        "line": 5,
        "scheme": "md5",
        "user": "support"
      },
      "filesystem": "image/squashfs@0x10000",
      "id": "F-8b0fa6e81f3c",
      "offset": null,
      "path": "/etc/passwd",
      "remediation": "Move hashes to /etc/shadow with mode 0600/0640.",
      "rule_id": "FWA-CRED-002",
      "severity": "high",
      "title": "Password hash stored in world-readable /etc/passwd"
    },
    {
      "category": "credentials",
      "detail": "uci credential 'password' = to*** (len 12) on line 3",
      "evidence": {
        "form": "uci",
        "known_default": false,
        "line": 3,
        "name": "password",
        "value": "to*** (len 12)"
      },
      "filesystem": "image/squashfs@0x10000",
      "id": "F-7b3198650a8e",
      "offset": null,
      "path": "/etc/config/system",
      "remediation": "Provision secrets per device at runtime instead of baking them into the image.",
      "rule_id": "FWA-CRED-006",
      "severity": "high",
      "title": "Hardcoded credential in configuration or script"
    },
    {
      "category": "credentials",
      "detail": "plaintext web credential for 'webadmin' = ch*** (len 10) on line 2",
      "evidence": {
        "form": "web-plaintext",
        "known_default": false,
        "line": 2,
        "name": "webadmin",
        "value": "ch*** (len 10)"
      },
      "filesystem": "image/squashfs@0x10000",
      "id": "F-95a14646255d",
      "offset": null,
      "path": "/etc/httpd.conf",
      "remediation": "Provision secrets per device at runtime instead of baking them into the image.",
      "rule_id": "FWA-CRED-006",
      "severity": "high",
      "title": "Hardcoded credential in configuration or script"
    },
    {
      "category": "crypto",
      "detail": "PRIVATE KEY (unencrypted, ec-secp256r1 256 bits)",
      "evidence": {
        "algorithm": "ec-secp256r1",
        "bits": 256,
        "encrypted": false,
        "fingerprint": "sha256:a3abab4e73170bd594609eba35962ecfc85b0f83486e4228e8d06ed666939a15",
        "format": "pem",
        "label": "PRIVATE KEY",
        "parsed": true
      },
      "filesystem": "image",
      "id": "F-0f2ec39ac8db",
      "offset": 131147,
      "path": null,
      "remediation": "Generate keys per device at first boot; never ship a shared private key.",
      "rule_id": "FWA-KEY-001",
      "severity": "high",
      "title": "Embedded private key"
    },
    {
      "category": "crypto",
      "detail": "RSA PRIVATE KEY (unencrypted, rsa 1024 bits)",
      "evidence": {
        "algorithm": "rsa",
        "bits": 1024,
        "block_offset": 0,
        "encrypted": false,
        "fingerprint": "sha256:50c87258ea64d026aa041275b1c1cfccb98cac69861b3920b4bb0497d79b38f0",
        "format": "pem",
        "label": "RSA PRIVATE KEY",
        "parsed": true
      },
      "filesystem": "image/squashfs@0x10000",
      "id": "F-75544ef3e8cc",
      "offset": null,
      "path": "/etc/ssl/private/server.key",
      "remediation": "Generate keys per device at first boot; never ship a shared private key.",
      "rule_id": "FWA-KEY-001",
      "severity": "high",
      "title": "Embedded private key"
    },
    {
      "category": "credentials",
      "detail": "password for 'support' uses md5 crypt",
      "evidence": {
        "line": 5,
        "scheme": "md5",
        "user": "support"
      },
      "filesystem": "image/squashfs@0x10000",
      "id": "F-c7f1f512aaa4",
      "offset": null,
      "path": "/etc/passwd",
      "remediation": "Use sha512-crypt, bcrypt or yescrypt.",
      "rule_id": "FWA-CRED-003",
      "severity": "medium",